{
  "stock": {
    "slug": "elephant-hide-110",
    "name": {
      "en": "Elephant Hide paper 110 g/m²",
      "es": "Papel Elephant Hide 110 g/m²",
      "fr": "Papier Elephant Hide 110 g/m²",
      "pt": "Papel Elephant Hide 110 g/m²"
    },
    "class": "origami",
    "fiber": [
      "wood-pulp"
    ],
    "finish": "sized",
    "color": "#c8b48a",
    "grain": "long"
  },
  "physical": {
    "gsm": {
      "value": 110,
      "status": "nominal",
      "source": "sold grade (Talas) — https://www.talasonline.com/Elephant-Hide-Paper"
    },
    "caliper_um": {
      "value": 120,
      "status": "estimated",
      "basis": "dense parchment-like sheet, rsE §b [E]"
    },
    "E_md_gpa": {
      "value": 6.5,
      "status": "estimated",
      "basis": "rsE §b: dense parchment-like sheet [E]"
    },
    "E_cd_gpa": {
      "value": 3.2,
      "status": "estimated",
      "basis": "MD/CD ≈ 2 for machine-made paper (Baum et al. 1981)"
    },
    "nu": {
      "value": 0.293,
      "status": "estimated",
      "basis": "√(ν12·ν21) = 0.293 for machine-made paper (Baum et al. 1981)"
    },
    "bending_stiffness_mNm": {
      "md": null,
      "cd": null,
      "method": null
    },
    "crease_length_scale_t": {
      "value": 200,
      "status": "estimated",
      "basis": "L* ≈ 200·t measured on Mylar (Lechenault 2014); paper unmeasured"
    },
    "crease_yield_deg": {
      "value": 35,
      "status": "estimated",
      "basis": "rest opening 27–43° after creasing (Lechenault 2014)"
    },
    "tear_strain": {
      "value": 0.02,
      "status": "estimated",
      "basis": "dense sized sheet [E]"
    },
    "friction": {
      "value": 0.4,
      "status": "estimated",
      "basis": "paper on paper 0.3–0.6 (rsE §a3)"
    }
  },
  "fabrication": {
    "min_feature_mm": 1.0,
    "score": "optional; wet-folding recommended for curves",
    "laser": null,
    "plotter": null,
    "glue": [
      "pva",
      "methyl-cellulose"
    ],
    "perforation": {
      "cut_mm": 3.0,
      "bridge_mm": 1.0
    }
  },
  "appearance": {
    "front": "#c8b48a",
    "back": "#c8b48a",
    "translucency": 0.08,
    "roughness": 0.7
  },
  "derived": {
    "areal_density": 0.00011,
    "thickness": 0.12,
    "E_md": 6500000000.0,
    "E_cd": 3200000000.0,
    "nu": 0.293,
    "D_md": 1023900.0,
    "D_cd": 504074.0,
    "crease_k": 29934.0,
    "crease_yield_deg": 35.0,
    "crease_set_rate": 0.5,
    "score_factor": 0.35,
    "perf_factor": 0.25,
    "tear_strain": 0.02,
    "friction": 0.4,
    "collision_thickness": 0.12
  },
  "derived_basis": "pliego.stock.derive v1",
  "provenance": {
    "author": "Innovaciones MADFAM",
    "license": "CERN-OHL-W-2.0",
    "sources": [
      "Talas — https://www.talasonline.com/Elephant-Hide-Paper",
      "Pliego research memo rsE (2026-10-10) §b material default table — engineering estimates [E] unless a source is cited",
      "Baum, Habeger & Fleischman 1981, Measurement of the orthotropic elastic constants of paper — https://bioresources.cnr.ncsu.edu/resources/measurement-of-the-orthotropic-elastic-constants-of-paper/",
      "Lechenault, Thiria & Adda-Bedia 2014, Mechanical response of a creased sheet, PRL 112, 244301 — https://arxiv.org/abs/1404.1243"
    ]
  }
}
