{
  "stock": {
    "slug": "copy-80",
    "name": {
      "en": "Copy paper 80 g/m²",
      "es": "Papel bond 80 g/m²",
      "fr": "Papier ramette 80 g/m²",
      "pt": "Papel sulfite 80 g/m²"
    },
    "class": "text",
    "fiber": [
      "wood-pulp"
    ],
    "finish": "uncoated",
    "color": "#f7f7f2",
    "grain": "long"
  },
  "physical": {
    "gsm": {
      "value": 80,
      "status": "nominal",
      "source": "grade designation"
    },
    "caliper_um": {
      "value": 100,
      "status": "estimated",
      "basis": "typical 0.8 g/cm³ office grade"
    },
    "E_md_gpa": {
      "value": 5.5,
      "status": "estimated",
      "basis": "rsE §b, TSI × density"
    },
    "E_cd_gpa": {
      "value": 2.5,
      "status": "estimated",
      "basis": "MD/CD ≈ 2.2 (Baum et al. 1981)"
    },
    "nu": {
      "value": 0.293,
      "status": "estimated",
      "basis": "√(ν12·ν21) = 0.293 for machine-made paper (Baum et al. 1981)"
    },
    "bending_stiffness_mNm": {
      "md": null,
      "cd": null,
      "method": null
    },
    "crease_length_scale_t": {
      "value": 200,
      "status": "estimated",
      "basis": "L* ≈ 200·t measured on Mylar (Lechenault 2014); paper unmeasured"
    },
    "crease_yield_deg": {
      "value": 35,
      "status": "estimated",
      "basis": "rest opening 27–43° after creasing (Lechenault 2014)"
    },
    "tear_strain": {
      "value": 0.02,
      "status": "estimated",
      "basis": "typical elongation at break, office grade"
    },
    "friction": {
      "value": 0.4,
      "status": "estimated",
      "basis": "paper on paper 0.3–0.6 (rsE §a3)"
    }
  },
  "fabrication": {
    "min_feature_mm": 1.0,
    "score": "recommended above 160 g/m²",
    "laser": null,
    "plotter": null,
    "glue": [
      "pva",
      "glue-stick",
      "double-sided-tape"
    ],
    "perforation": {
      "cut_mm": 3.0,
      "bridge_mm": 1.0
    }
  },
  "appearance": {
    "front": "#f7f7f2",
    "back": "#f7f7f2",
    "translucency": 0.15,
    "roughness": 0.9
  },
  "derived": {
    "areal_density": 8e-05,
    "thickness": 0.1,
    "E_md": 5500000000.0,
    "E_cd": 2500000000.0,
    "nu": 0.293,
    "D_md": 501376.0,
    "D_cd": 227898.0,
    "crease_k": 16901.4,
    "crease_yield_deg": 35.0,
    "crease_set_rate": 0.5,
    "score_factor": 0.35,
    "perf_factor": 0.25,
    "tear_strain": 0.02,
    "friction": 0.4,
    "collision_thickness": 0.1
  },
  "derived_basis": "pliego.stock.derive v1",
  "provenance": {
    "author": "Innovaciones MADFAM",
    "license": "CERN-OHL-W-2.0",
    "sources": [
      "Pliego research memo rsE (2026-10-10) §b material default table — engineering estimates [E] unless a source is cited",
      "Baum, Habeger & Fleischman 1981, Measurement of the orthotropic elastic constants of paper — https://bioresources.cnr.ncsu.edu/resources/measurement-of-the-orthotropic-elastic-constants-of-paper/",
      "Lechenault, Thiria & Adda-Bedia 2014, Mechanical response of a creased sheet, PRL 112, 244301 — https://arxiv.org/abs/1404.1243"
    ]
  }
}
