{
  "stock": {
    "slug": "cardstock-160",
    "name": {
      "en": "Cardstock 160 g/m²",
      "es": "Cartulina 160 g/m²",
      "fr": "Bristol 160 g/m²",
      "pt": "Cartolina 160 g/m²"
    },
    "class": "cardstock",
    "fiber": [
      "wood-pulp"
    ],
    "finish": "uncoated",
    "color": "#f4efe6",
    "grain": "long"
  },
  "physical": {
    "gsm": {
      "value": 160,
      "status": "nominal",
      "source": "grade designation"
    },
    "caliper_um": {
      "value": 200,
      "status": "estimated",
      "basis": "≈ 0.8 g/cm³ board, rsE §b"
    },
    "E_md_gpa": {
      "value": 4.5,
      "status": "estimated",
      "basis": "rsE §b [E]; textured art boards can be far lower (Canson Mi-Teintes 160 g/m² ≈ 1.22 GPa, arXiv:2408.01889)"
    },
    "E_cd_gpa": {
      "value": 2.0,
      "status": "estimated",
      "basis": "MD/CD ≈ 2 for machine-made paper (Baum et al. 1981)"
    },
    "nu": {
      "value": 0.293,
      "status": "estimated",
      "basis": "√(ν12·ν21) = 0.293 for machine-made paper (Baum et al. 1981)"
    },
    "bending_stiffness_mNm": {
      "md": null,
      "cd": null,
      "method": null
    },
    "crease_length_scale_t": {
      "value": 200,
      "status": "estimated",
      "basis": "L* ≈ 200·t measured on Mylar (Lechenault 2014); paper unmeasured"
    },
    "crease_yield_deg": {
      "value": 35,
      "status": "estimated",
      "basis": "rest opening 27–43° after creasing (Lechenault 2014)"
    },
    "tear_strain": {
      "value": 0.015,
      "status": "estimated",
      "basis": "board grades, lower elongation [E]"
    },
    "friction": {
      "value": 0.4,
      "status": "estimated",
      "basis": "paper on paper 0.3–0.6 (rsE §a3)"
    }
  },
  "fabrication": {
    "min_feature_mm": 1.5,
    "score": "required: score every fold",
    "laser": null,
    "plotter": null,
    "glue": [
      "pva",
      "double-sided-tape"
    ],
    "perforation": {
      "cut_mm": 3.0,
      "bridge_mm": 1.0
    }
  },
  "appearance": {
    "front": "#f4efe6",
    "back": "#f4efe6",
    "translucency": 0.06,
    "roughness": 0.85
  },
  "derived": {
    "areal_density": 0.00016,
    "thickness": 0.2,
    "E_md": 4500000000.0,
    "E_cd": 2000000000.0,
    "nu": 0.293,
    "D_md": 3281730.0,
    "D_cd": 1458550.0,
    "crease_k": 54695.6,
    "crease_yield_deg": 35.0,
    "crease_set_rate": 0.5,
    "score_factor": 0.35,
    "perf_factor": 0.25,
    "tear_strain": 0.015,
    "friction": 0.4,
    "collision_thickness": 0.2
  },
  "derived_basis": "pliego.stock.derive v1",
  "provenance": {
    "author": "Innovaciones MADFAM",
    "license": "CERN-OHL-W-2.0",
    "sources": [
      "arXiv:2408.01889 — https://arxiv.org/pdf/2408.01889",
      "Pliego research memo rsE (2026-10-10) §b material default table — engineering estimates [E] unless a source is cited",
      "Baum, Habeger & Fleischman 1981, Measurement of the orthotropic elastic constants of paper — https://bioresources.cnr.ncsu.edu/resources/measurement-of-the-orthotropic-elastic-constants-of-paper/",
      "Lechenault, Thiria & Adda-Bedia 2014, Mechanical response of a creased sheet, PRL 112, 244301 — https://arxiv.org/abs/1404.1243"
    ]
  }
}
