{
  "stock": {
    "slug": "kami",
    "name": {
      "en": "Kami origami paper",
      "es": "Papel kami para origami",
      "fr": "Papier kami pour origami",
      "pt": "Papel kami para origami"
    },
    "class": "origami",
    "fiber": [
      "wood-pulp"
    ],
    "finish": "uncoated",
    "color": "#d9382b",
    "grain": "long"
  },
  "physical": {
    "gsm": {
      "value": 63,
      "status": "measured",
      "source": "origami.me/paper — reported measurement of kami (rsE §b)"
    },
    "caliper_um": {
      "value": 72,
      "status": "measured",
      "source": "origami.me/paper — reported measurement of kami (rsE §b)"
    },
    "E_md_gpa": {
      "value": 5.0,
      "status": "estimated",
      "basis": "rsE §b: specific tensile stiffness × density [E]"
    },
    "E_cd_gpa": {
      "value": 2.3,
      "status": "estimated",
      "basis": "MD/CD ≈ 2 for machine-made paper (Baum et al. 1981)"
    },
    "nu": {
      "value": 0.293,
      "status": "estimated",
      "basis": "√(ν12·ν21) = 0.293 for machine-made paper (Baum et al. 1981)"
    },
    "bending_stiffness_mNm": {
      "md": null,
      "cd": null,
      "method": null
    },
    "crease_length_scale_t": {
      "value": 200,
      "status": "estimated",
      "basis": "L* ≈ 200·t measured on Mylar (Lechenault 2014); paper unmeasured"
    },
    "crease_yield_deg": {
      "value": 35,
      "status": "estimated",
      "basis": "rest opening 27–43° after creasing (Lechenault 2014)"
    },
    "tear_strain": {
      "value": 0.015,
      "status": "estimated",
      "basis": "thin printing grade [E]"
    },
    "friction": {
      "value": 0.4,
      "status": "estimated",
      "basis": "paper on paper 0.3–0.6 (rsE §a3)"
    }
  },
  "fabrication": {
    "min_feature_mm": 1.0,
    "score": null,
    "laser": null,
    "plotter": null,
    "glue": [
      "glue-stick",
      "pva"
    ],
    "perforation": {
      "cut_mm": 3.0,
      "bridge_mm": 1.0
    }
  },
  "appearance": {
    "front": "#d9382b",
    "back": "#f6f3ec",
    "translucency": 0.2,
    "roughness": 0.8
  },
  "derived": {
    "areal_density": 6.3e-05,
    "thickness": 0.072,
    "E_md": 5000000000.0,
    "E_cd": 2300000000.0,
    "nu": 0.293,
    "D_md": 170125.0,
    "D_cd": 78257.5,
    "crease_k": 8012.81,
    "crease_yield_deg": 35.0,
    "crease_set_rate": 0.5,
    "score_factor": 0.35,
    "perf_factor": 0.25,
    "tear_strain": 0.015,
    "friction": 0.4,
    "collision_thickness": 0.072
  },
  "derived_basis": "pliego.stock.derive v1",
  "provenance": {
    "author": "Innovaciones MADFAM",
    "license": "CERN-OHL-W-2.0",
    "sources": [
      "origami.me — https://origami.me/paper/",
      "Pliego research memo rsE (2026-10-10) §b material default table — engineering estimates [E] unless a source is cited",
      "Baum, Habeger & Fleischman 1981, Measurement of the orthotropic elastic constants of paper — https://bioresources.cnr.ncsu.edu/resources/measurement-of-the-orthotropic-elastic-constants-of-paper/",
      "Lechenault, Thiria & Adda-Bedia 2014, Mechanical response of a creased sheet, PRL 112, 244301 — https://arxiv.org/abs/1404.1243"
    ]
  }
}
